No,Name,PTI-IND,PML-N,PPP,TLP,Total Votes,Filename
1,Govt. Elementry College Qaed Bwp,491,262,18,49,,
2,Social Welfare Fouji Basti Near Police Station,403,179,24,20,,
3,Govt. Girls High School Islamic Colony,308,0,20,67,,
4,Govt Darul Aftal Islamic Colony (Male),330,335,82,49,,
5,Govt. Girls High School Islamic Colony,440,374,46,135,,
6,Arabic Elementry School Islamic Colony Bwp,349,291,48,82,,
7,Govt.  High School Islamic Colony Female 1,147,0,72,9,,
8,Gps Basti Banga Islamic Colony (Male) Bwp,193,229,61,25,,
9,Govt.  High School Canal Colony Near Kali Pulli Male 1,666,341,29,37,,
10,Govt. Girls High School Canal Colony,547,244,24,20,,
11,Aeo Quarter No 34 1 Unit Staff Colony (Male),639,231,14,34,,
12,Gg E/S Medical Colony Near Markazi Jamiya Masjid,585,154,16,19,,
13,Govt. Technical Training Institute (Male 1),180,88,8,15,,
14,Govt. Girls Technical Training Institute (Female 1),138,41,4,2,,
15,Govt Technical Institute  Combined 1,360,246,12,31,,
16,Govt. Technical Training Institute (Male 2),472,298,12,23,,
17,Govt. Technical Training Institute (Female 2),334,212,10,23,,
18,Govt. Girls E/S Medical Colony 1 Unit (Male 1),364,133,12,16,,
19,Govt. Girls E/S Medical Colony 1 Unit (Female 2),298,116,8,9,,
20,Gg E/S Islamic Melay Wali Gali Colony (Male 1),405,234,15,18,,
21,Gg E/S Islam Mudarsa Hematiya Melay Wali Gali (Female 1),311,167,17,8,,
22,Office Of Deputy Deo (Male 1),447,241,16,19,,
23,Govt. Primery School  Satlite Town (Female 1),431,166,19,7,,
24,Govr Model English School Tibba Badar Sher (Male 1),547,304,27,41,,
25,Govt Model Girls English Medium Primery School Awami Scholl Tibba Badar (Female 1),432,219,42,24,,
26,Govt Girls Public School Muqbool Colony  (Male 1),318,243,13,66,,
27,Govt Girls Public School Muqbool Colony  (Female 1),318,199,24,25,,
28,Punjab Forest  Boys School Bagdad Road  (Male),220,178,23,16,,
29,Punjab Forest  Girls School Bagdad Road (Female),183,130,30,4,,
30,Govt Girls Degree College For Women (Male 1),359,188,8,28,,
31,Govt Girls High School Muhajar Colony (Female 1),287,161,7,22,,
32,Govt Boys High School Muhajar Colony (Male 1),550,395,12,42,,
33,Govt Girls High School Muhajar Colony (Female 2),335,280,10,30,,
34,Govt English Medium Boys Primery School C/N 9/Bc,519,377,28,46,,
35,Govt Girls E/S C/N 9/Bc,382,264,78,21,,
36,Govt School Shah Suleman Tibba Badar Shar (Male 1),378,316,15,77,,
37,Govt Girls Public School Tibba Badar Shar (Female 1),281,223,23,36,,
38,Red Rose Model School Mohalla Gulshan Habib Tibba Badar Sher Bwp (Male 1),397,325,38,58,,
39,Red Rose Model School Mohalla Gulshan Habib Tibba Badar Sher Bwp (Female 1),265,193,69,36,,
40,Girls Model Primery School  Tibba Badar Shar,397,156,16,58,,
41,Govt Girls Primery School Tibba Badar Shar Building 1 Near Aqsa Masjid,215,166,12,45,,
42,Govt Girls Model Public School Tibba Badar Shar Building 3,149,123,18,21,,
43,Govt Girls High School Tibba Badar Shar (Male 1),407,287,17,96,,
44,Govt Girls High School Tibba Badar Shar (Female 1),357,219,38,66,,
45,Govt E/S Boys Shah Suleman Tibba Badar Shar (Male 2,225,249,11,86,,
46,Govt Girls High School Tibba Badar Shar Building 2 (Female 2),143,194,25,45,,
47,Govt Primery School Govt Employees Society Combined- 1,386,94,6,20,,
48,Aiou Office (Male 1 ),185,285,35,21,,
49,Aiou Office,113,0,80,26,,
50,Govt Boys High School Jhangiwala (Male 1),449,154,22,28,,
51,Govt Boys High School Jhangiwala (Female 1),347,121,34,14,,
52,Govt High School Basti Salah (Male 1),370,408,34,15,,
53,Govt Boys High School Basti Salah (Female 1),261,279,34,1,,
54,Govt Boys Public School Akhtarabad (Male 1),559,312,31,29,,
55,Govt Primery School Akhtarabad (Female 1),368,165,34,17,,
56,Govt Boys Primery School Basti Bhatiya (Male 1),242,289,29,11,,
57,Govt Girls Public School Mari Elachi (Female 1),481,295,36,21,,
58,Govt School Baqirpur (Male 1),229,328,32,30,,
59,Govt E/S Boys Baqirpur (Male 2),164,323,35,56,,
60,Govt Boys E/S Baqirpur (Female 1),92,228,44,25,,
61,Govt Vacational Boys Training Institute (Male 1),339,167,4,22,,
62,Govt Vacational Girls Training Institute (Female 1),270,94,11,12,,
63,Govt Girls Sadiq High School Machali Talab (Male 1),285,109,9,7,,
64,Govt Girls High School Machali Talab (Female 1),212,85,7,1,,
65,Moon System Of Education Darbar Mahal (Male 1),465,359,15,17,,
66,Ahmed Public School Basti Matma (Female 1),359,252,16,18,,
67,Wapda Office Sadar Puli (Male 1),294,196,6,9,,
68,Wapda Office Female Sadar Puli (Female 1),205,138,18,4,,
69,Shahda Aps Boys High School Satelite Town (Male 1),487,127,11,13,,
70,Govt Girls High School Satelite Town (Male 1),381,128,7,12,,
71,Apwa Girls High School Satelite Town (Female 1),326,84,3,8,,
72,Govt College Of Technology Satelite Town (Male 1),416,169,14,18,,
73,Office Of Telephone Exchange Satelite Town (Male 1),625,210,6,21,,
74,Office Of Telephone Exchange Satelite Town (Female 1),522,147,7,9,,
75,Govt Women Degree College Satelite Town (Male 2),586,209,6,16,,
76,Apwa Girls High School Satelite Town (Female 1),521,123,7,4,,
77,Govt College Of Technology  Satelite Town (Male 2),465,138,4,11,,
78,Union Councel 9 Female Satelite Town (Female 1),426,68,2,6,,
79,Govt Model Primery School Basti Samlan Combined 1,275,158,51,29,,
80,Govt Model Primery School Basti Samlan Combined 2,418,284,26,44,,
81,Govt Girls High School Basti Pnwa,549,291,48,76,,
82,Basic Health Unit Jhangiwala Combined 1,812,201,36,23,,
83,Govt Model Primery School Got Lashker (Male 1),554,239,22,35,,
84,Govt Girls E/S Jhokshara Combined 1,150,545,96,13,,
85,Govt  Boys E/S Baqirpur (Male 3),302,445,7,32,,
86,Govt E/S Qasim Shah (Male 1),633,452,31,55,,
87,Zanana Govt Boys E/S Qasim Shah,470,335,58,36,,
88,Govt E/S Mari,548,206,37,45,,
89,Govt. E/S Miani Jhabli Combined 1,598,356,33,19,,
90,Govt. E/S Miani Jhabli,339,214,6,10,,
91,Govt E/S Nawabpura,411,831,44,29,,
92,N/A,0,0,0,0,,
93,N/A,0,0,0,0,,
94,N/A,0,0,0,0,,
95,N/A,216,426,10,21,,
96,Govt Se College (Male 1),462,186,12,15,,
97,Govt Se College (Female 1),374,144,18,6,,
98,Govt. Primery School Basti Derwesha,250,194,37,25,,
99,Govt Model Public School Judgewali (Female 1),134,112,38,6,,
100,Stadium Bwp (Male 1),524,199,21,23,,
101,Stadium Bwp (Female 1),434,131,20,14,,
102,Govt Sadiq Women University Bwp (Male 1),433,146,18,27,,
103,Govt Sadiq Women University Bwp (Female 1),403,125,16,22,,
104,Govt Comprehensive High School Bwp,605,279,15,30,,
105,Govt Comprehensive Girls High School Bwp,487,212,13,29,,
106,Mc Girls Primery School,500,246,41,21,,
107,Govt Boys Primery School Javed Colony,449,363,18,27,,
108,Falahi Markaz Jafri Town,380,350,62,55,,
109,Gps Basti Ghous Bakhsh,251,210,85,2,,
110,Residency Cevil Defense,296,474,14,18,,
111,Govt College Of Elementry Teachers Training Boys,453,125,11,6,,
112,Govt College Of Elementry Teachers Trainoing Women,437,106,14,3,,
113,Govt Girls Higher School Model Town A,465,144,40,4,,
114,Govt Girls Higher School Model Town A,444,96,34,5,,
115,Fg College,229,81,143,6,,
116,Gps Malok Shah,376,136,32,7,,
117,Govt Ghs Basti Riddan,695,141,57,12,,
118,Govt Ghs Basti Riddan Boys,503,265,80,40,,
119,Govt Ghs Basti Riddan Female 2,284,280,177,21,,
120,Govt Ghs Basti Riddan Boys 1,478,281,43,47,,
121,Govt E/S Basti Malok Shah,221,114,48,22,,
122,Govt Boys Primery School Mamoonabad,349,226,33,45,,
123,Canyt Public Girls High School Dera Izzat,213,140,57,30,,
124,Govt E/S Dera Izzat Male,285,143,26,21,,
125,Govt E/S Dera Izzat Female,174,61,53,17,,
126,Office Of Director Live Stock,343,123,13,32,,
127,Govt Cvh Near Sabzi Mandi,273,81,13,21,,
128,Craft Bazar Spcial Welfare (Male 1),357,186,16,84,,
129,Govt. Cevil Veternary (Female 1),262,120,18,55,,
130,Govt. Girls High School Imam Shah,354,266,23,15,,
131,Govt School Thana Kotwal,288,135,16,6,,
132,Govt. Girls High School Imam Shah Combined,424,179,31,11,,
133,Govt Primery School Mukhdompura,302,135,21,15,,
134,Metropolitial Corporatipon Office,483,201,28,16,,
135,Govt Girls School Khaliwala,250,97,35,4,,
136,Metropolitial Corporatipon Office (Female 1),306,104,24,11,,
137,Govt. School Machli Bazar,391,258,23,34,,
138,Govt. Frabi Hotel,470,390,40,19,,
139,Govt. Frabi Hotel (Female),276,174,27,8,,
140,Apwa Fareed Gate,378,180,28,19,,
141,Apwa Fareed Gate (Male 1),373,269,10,10,,
142,Jubilee Zanana Hospital,253,165,7,2,,
143,Govt. Boys High School Shahfatah Khan,404,214,28,11,,
144,"Govt, Mc Girls High School",427,151,8,8,,
145,"Govt, Mc Girls High School (Female 1)",338,79,21,7,,
146,Govt. Girls High School Shahfatah Khan,345,128,25,5,,
147,Govt Mc School Medical Colony,458,192,27,13,,
148,Hostel School Of Allied Sciences,380,165,18,15,,
149,Jubilee Zanana Hospital (Male 1),517,314,32,16,,
150,Govt. Girls High School Shahfatah Khan (Female 2),372,156,13,5,,
151,"Govt, Mc Girls High School Haronia",380,107,34,12,,
152,"Govt, Mc Girls High School Haronia  (Male 1)",356,205,37,16,,
153,Shahdab English School,283,280,19,10,,
154,University Public School,276,237,11,10,,
155,Govt Mc High School (Male 1),583,372,34,26,,
156,Govt Mc High School (Female 1),396,204,30,8,,
157,University Public School,444,360,40,24,,
158,Govt Mc Girlshigh School,320,228,31,15,,
159,Office Of Cantonment Fawara Chowk,364,211,16,15,,
160,Office Of Cantonment Fawara Chowk (Male 2),310,202,21,12,,
161,Wapda Colony (Female 1),232,117,22,10,,
162,Wapda Colony (Female 2),226,133,15,6,,
163,Federal Govt College (Male 1),565,157,11,20,,
164,Federal Govt College (Female 1),492,113,5,0,,
165,Universal Institute Of Health Sciences,463,249,10,10,,
166,Govt Girls School Trust Colony,395,139,22,10,,
167,Regional  Employess Oldage Institue,404,199,8,10,,
168,Govt GirLs Degree College (Male 1,472,276,21,38,,
169,Govt GirLs Degree College (Female 1,379,216,19,27,,
170,Govt GirLs Degree College Combined 1,494,223,29,21,,
171,Cant Public Institute,428,303,34,47,,
172,Govt Girls School Bhatta No. 1 (Female 1),258,231,73,8,,
173,Govt Girls School Bhatta No. 1 (Male 1),334,229,30,18,,
174,Govt Girls School Bhatta No. 1 (Female 2),219,185,39,17,,
175,Govt Girls School Bhatta No. 1 (Male 2),197,191,11,26,,
176,Govt Girls School Bhatta No. 1 (Female 1),169,191,28,14,,
177,Govt Girls School Raman,446,388,19,53,,
178,Uninion Council 21 Raman,320,194,82,33,,
179,Govt. School Basti Agha Pur,348,498,53,75,,
180,Govt. School Basti Agha Pur Female 1,191,339,115,35,,
181,Govt. School Dera Masti,258,371,44,41,,
182,Govt. Girls School Dera Masti,281,490,47,67,,
183,Govt. School Goth Gehna,240,390,51,27,,
184,Govt. School Goth Gehna (Female 1),127,244,126,24,,
185,Govt. High School Shadra (Male 1),415,172,5,16,,
186,Govt. High School Shadra (Male 2),419,274,7,19,,
187,Govt. High School Shadra (Female 1),290,91,19,10,,
188,Govt. High School Shadra (Female 2),212,121,14,6,,
189,Govt. High School  Model Town Shadra (Male 1),653,200,12,11,,
190,Govt. Girls School Basti Shadra,361,191,13,18,,
191,Bright School Railway,225,96,18,5,,
192,Union Councel Basti Shadra,321,250,36,24,,
193,Govt. Tibia College,374,238,14,27,,
194,Govt. Tibia College  (Female 1),253,174,37,15,,
195,Govt. Tibia College  (Male 2),500,194,8,13,,
196,Office Market Committee,420,127,8,9,,
197,Pace School,556,195,14,11,,
198,Homeopathic College,532,128,8,6,,
199,Govt. Abbasia School ( Female 1),494,173,6,7,,
200,Govt. Abbasia School ( Male 2),275,107,3,4,,
201,Govt. Abbasia School ( Female 2),220,204,4,1,,
202,Mc Model Town School (Male 1),468,362,13,19,,
203,Mc Model Town School (Female  1),387,226,31,8,,
204,Govt. Girls High School Habib Colony,386,204,17,11,,
205,Govt. Girls School Habib Colony (Female 1),341,149,15,8,,
206,Govt. Girls School Habib Colony (Male 1),306,88,4,5,,
207,Govt Model High School,257,66,7,5,,
208,Regional Training Institute,372,144,51,41,,
209,Staff Training College,256,70,75,17,,
210,Sadiq College (Ma;Le 1),496,189,14,9,,
211,Sadiq College (Female 1),434,119,6,1,,
212,Govt School Bhatta No. 4,176,116,29,14,,
213,Office Of Agriculture Engineering,393,337,55,77,,
214,Govt School Bhatta No. 4 (Female 2),256,213,124,25,,
215,Union Councel No. 20,546,408,49,42,,
216,Arabic School,317,220,110,29,,
217,Govt Girls School Chahshniwala,275,159,16,20,,
218,Camp Office Secterate,520,417,31,81,,
219,Govt. School Basti Hooriya,342,280,128,35,,
220,Govt. Arabic School (Male 2),349,247,43,65,,
221,Govt. Arabic School (Male 3),234,142,27,58,,
222,Govt School Gothghani,208,195,79,46,,
223,Boys School Gothghani (Female 1),148,98,51,21,,
224,Azhar Public School,324,371,301,67,,
225,Govt. School Baloch Colony,205,246,278,38,,
226,Worker Welfare High School,217,221,39,66,,
227,Wapda Complex,166,278,26,95,,
228,Worker Welfare High School (Female 1),130,164,55,32,,
229,Govt School Shadra Model Town B,551,351,11,64,,
230,Pioneer High School,267,240,9,22,,
231,Iqra School,167,149,18,3,,
232,Karkhana Zaria Allat (Male 1),576,355,21,107,,
233,Karkhana Zaria Allat (Female 1),357,226,52,50,,
234,Iqra School Combined 1,291,186,63,115,,
235,Govt Arabic School Combined 1,131,0,0,0,,
236,Govt. Boys School Fattuwali,701,351,47,104,,
237,Govt. Boys School Fattuwali Combined 1,157,125,30,32,,
238,Govt. Boys School Fattuwali Female  1,453,274,7,2,,
239,Govt School Peer Alladeta (Male 1),183,223,37,18,,
240,Govt. School Basti Qadir E Bad,203,360,41,43,,
241,Govt School Qufarabad,352,437,32,51,,
242,Govt Arabic School (Male 1),361,626,16,31,,
